{
  "$schema": "http://json-schema.org/draft-07/schema#",
  "title": "Shopify Extension Generator Schemas",
  "type": "object",
  "properties": {
    "handle": {
      "type": "string",
      "pattern": "^[a-z][a-z]+(-[a-z]+)+$",
      "minLength": 4,
      "maxLength": 60
    },
    "name": {
      "type": "string",
      "minLength": 4,
      "maxLength": 60
    },
    "description": {
      "type": "string",
      "minLength": 10,
      "maxLength": 100
    },
    "templatePath": {
      "type": "string",
      "minLength": 10
    },
    "targetPath": {
      "type": "string",
      "minLength": 10
    }
  },
  "required": [
    "handle",
    "name",
    "description",
    "templatePath",
    "targetPath"
  ]
}
