{
  "handle": "send-professional-letter",
  "name": "Send Professional Letter",
  "description": "Create and mail a professional letter using Open Letter Connect.",
  "templatePath": "{{srcPath}}/templates/shopify-extension.njk",
  "targetPath": "{{rootPath}}/extensions/{{handle}}/shopify.extension.toml"
}
