{
  "handle": "send-real-penned-letter",
  "name": "Send Real Penned Letter",
  "description": "Create and mail a real penned letter using Open Letter Connect.",
  "templatePath": "{{srcPath}}/templates/shopify-extension.njk",
  "targetPath": "{{rootPath}}/extensions/{{handle}}/shopify.extension.toml"
}
